gameid,time,roundNum,sender,contents
8631-d,1592941895625,1,speaker,"red door"
8631-d,1592941923978,1,speaker,"you will want to choose the red door"
8631-d,1592941976844,1,speaker,"Is anyone there?"
8631-d,1592941988548,2,speaker,"please choose the green ball"
8631-d,1592942034086,3,speaker,"please choose the rectangle shaped table"
8631-d,1592942042269,4,speaker,"please choose the blue chest"
8631-d,1592942056614,5,speaker,"please choose the blue rectangle table"
8631-d,1592942083902,6,speaker,"please choose the blue plate that is different than the other three plates"
8631-d,1592942098138,7,speaker,"please choose the silver ball"
8631-d,1592942116674,8,speaker,"please choose the purple jacket that is not shiny"
8631-d,1592942142361,9,speaker,"please choose the green bottle with the metal clip on the cap"
8631-d,1592942158977,10,speaker,"please choose the blue plate that does not match the other three plates"
8631-d,1592942173346,11,speaker,"please choose the green ruler"
8631-d,1592942190306,12,speaker,"Please choose the rectangle shaped green table"
8631-d,1592942211059,13,speaker,"please choose the green boot"
8631-d,1592942223981,14,speaker,"please choose the green cup without a handle"
8631-d,1592942235223,15,speaker,"please choose the blue plate"
8631-d,1592942248844,16,speaker,"please choose the blue vase"
8631-d,1592942259934,17,speaker,"Please choose the brown vase"
8631-d,1592942279390,18,speaker,"please choose the metallic blue pitcher"
8631-d,1592942289293,19,speaker,"please choose the blue bowl"
8631-d,1592942299222,20,speaker,"please choose the green chair"
8631-d,1592942309955,21,speaker,"please choose the blue plastic bag"
8631-d,1592942317791,22,speaker,"please choose the blue bowl"
8631-d,1592942324691,23,speaker,"please choose the green spoon"
8631-d,1592942331007,24,speaker,"please choose the door"
8631-d,1592942344570,25,speaker,"please choose the green bottle that does not match the other bottles"
8631-d,1592942351648,26,speaker,"please choose the purple chair"
8631-d,1592942362288,27,speaker,"please choose the gray rectangle table"
8631-d,1592942370584,28,speaker,"please choose the blue ruler"
8631-d,1592942377856,29,speaker,"please choose the blue ball"
